<?xml version="1.0" encoding="UTF-8"?>
<!DOCTYPE companies [
    <!ELEMENT companies (company+)>
    <!ELEMENT company (name, location, revenue, employees, departments)>
    <!ATTLIST company industry CDATA #REQUIRED>
    <!ATTLIST company status (public|private) #REQUIRED>
    <!ELEMENT name (#PCDATA)>
    <!ELEMENT location (#PCDATA)>
    <!ELEMENT revenue (#PCDATA)>
    <!ELEMENT employees (#PCDATA)>
    <!ELEMENT departments (department+)>
    <!ELEMENT department (name, employees)>
]>
<!-- Use http://xmlvalidator.new-studio.org/ if you cant use VS code -->
<companies>
    <company industry="Technology" status="public">
        <name>TechCorp</name>
        <location>New York</location>
        <revenue>5000000</revenue>
        <employees>200</employees>
        <departments>
            <department>
                <name>Research and Development</name>
                <employees>50</employees>
            </department>
            <department>
                <name>Sales</name>
                <employees>30</employees>
            </department>
        </departments>
    </company>
    <company industry="Software" status="private">
        <name>InnoSoft</name>
        <location>San Francisco</location>
        <revenue>3000000</revenue>
        <employees>150</employees>
        <departments>
            <department>
                <name>Engineering</name>
                <employees>70</employees>
            </department>
            <department>
                <name>Marketing</name>
                <employees>20</employees>
            </department>
        </departments>
    </company>
    <company industry="Healthcare" status="public">
        <name>HealthPlus</name>
        <location>Boston</location>
        <revenue>7000000</revenue>
        <employees>350</employees>
        <departments>
            <department>
                <name>Medical Services</name>
                <employees>200</employees>
            </department>
            <department>
                <name>Administration</name>
                <employees>50</employees>
            </department>
        </departments>
    </company>
</companies>